{
  "validation_run_id": "validationrun_019f0000-0000-7000-8000-000000000001",
  "protocol_version": { "major": 1, "minor": 0 },
  "operation_id": "operation_019f0000-0000-7000-8000-000000000101",
  "target": {
    "kind": "runtime_snapshot",
    "id": "snapshot_019f0000-0000-7000-8000-000000000001"
  },
  "rule_set": {
    "kind": "validation_rule_set",
    "id": "ruleset.accessibility.core",
    "version": "1.0.0"
  },
  "state": "succeeded",
  "created_at": "2026-07-12T02:00:00.000Z",
  "started_at": "2026-07-12T02:00:00.100Z",
  "completed_at": "2026-07-12T02:00:01.000Z",
  "updated_at": "2026-07-12T02:00:01.000Z",
  "revision": 3,
  "finding_counts": {
    "total": 1,
    "open": 1,
    "suppressed": 0,
    "resolved": 0,
    "by_severity": {
      "info": 0,
      "warning": 1,
      "error": 0,
      "critical": 0
    }
  },
  "extensions": {}
}
